{
  "country": "Germany",
  "unit": "percentOfRoom",
  "currency": "EUR",
  "capNights": null,
  "regions": [
    { "key": "berlin", "label": "Berlin", "pct": 7.5, "note": "Berlin charges 7.5% of the net room rate. The old 21-night cap was removed from 1 January 2025, so a normal stay is taxable throughout.", "provenance": { "status": "verified", "checked_date": "2026-09-26", "changed_date": "2025-01", "source_url": "https://www.visitberlin.de/en/city-tax-berlin", "source_name": "visitBerlin, Berlin City Tax", "source_type": "official-government", "confidence": null } },
    { "key": "munich", "label": "Munich", "pct": 0, "note": "Munich charges no bed tax. Bavaria banned local hotel taxes, and the Bavarian Constitutional Court upheld that ban in 2025, so the city cannot levy one.", "provenance": { "status": "verified", "checked_date": "2026-09-28", "changed_date": null, "source_url": "https://www.bayern.verfassungsgerichtshof.de/bayverfgh/rechtsprechung/ausgewaehlte_entscheidungen.php", "source_name": "Bavarian Constitutional Court, 14 November 2025 decision", "source_type": "official-government", "confidence": "high" } },
    { "key": "hamburg", "label": "Hamburg", "pct": 2.1, "note": "Hamburg uses a sliding scale by room price rather than a flat percentage; this is roughly equivalent to about 2% of the room rate.", "provenance": { "status": "legacy", "checked_date": null, "changed_date": null, "source_url": null, "source_name": null, "source_type": null, "confidence": null } },
    { "key": "cologne", "label": "Cologne", "pct": 5, "note": "Cologne's culture tax (Kulturförderabgabe) runs 5% of the net room rate.", "provenance": { "status": "legacy", "checked_date": null, "changed_date": null, "source_url": null, "source_name": null, "source_type": null, "confidence": null } },
    { "key": "frankfurt", "label": "Frankfurt", "unit": "perPersonPerNight", "rate": 2, "note": "Frankfurt charges a flat 2 euros per person, per night, rather than a percentage.", "provenance": { "status": "legacy", "checked_date": null, "changed_date": null, "source_url": null, "source_name": null, "source_type": null, "confidence": null } },
    { "key": "other", "label": "Elsewhere in Germany", "pct": 0, "note": "Most German towns and smaller cities charge no bed tax at all. A separate Kurtaxe applies in officially designated spa and resort towns, typically 1.50 to 4 euros per person per night.", "provenance": { "status": "legacy", "checked_date": null, "changed_date": null, "source_url": null, "source_name": null, "source_type": null, "confidence": null } }
  ]
}
